<?xml version="1.0" encoding="utf-8"?>
<Content
  Version="4.0"
  xsi:schemaLocation="http://schemas.ntreev.com/crema/tables/Templates/ProjectInfo ProjectInfo.xsd"
  ProjectInfo.Modifier="s2quake"
  ProjectInfo.Count="6"
  ProjectInfo.ID="dea31cbb-0fbd-40b7-9e09-bf11038a3aca" xmlns:xsi="http://www.w3.org/2001/XMLSchema-instance" xmlns="http://schemas.ntreev.com/crema/tables/Templates/ProjectInfo">
  <ProjectInfo
    CreatedDateTime="2017-10-31T06:53:14.4202267Z"
    Modifier="admin"
    ModifiedDateTime="2017-11-01T08:23:24.3338315Z"
    RelationID="3690c9391151acd7057703cafb821469">
    <KindType>Client</KindType>
    <ProjectType>Library</ProjectType>
    <Name>Ntreev.Crema.Client.SmartSet</Name>
    <ProjectPath>client/Ntreev.Crema.Client.SmartSet/Ntreev.Crema.Client.SmartSet.csproj</ProjectPath>
  </ProjectInfo>
  <ProjectInfo
    CreatedDateTime="2017-10-31T06:53:14.4202267Z"
    Modifier="admin"
    ModifiedDateTime="2017-11-01T08:23:24.3494315Z"
    RelationID="e2d4fa01e336f756ad160c2cf7aa4711">
    <KindType>Client</KindType>
    <ProjectType>Library</ProjectType>
    <Name>Ntreev.Crema.Client.Common</Name>
    <ProjectPath>client/Ntreev.Crema.Client.Common/Ntreev.Crema.Client.Common.csproj</ProjectPath>
  </ProjectInfo>
  <ProjectInfo
    CreatedDateTime="2017-10-31T06:53:14.4212452Z"
    Modifier="admin"
    ModifiedDateTime="2017-11-01T08:23:24.3494315Z"
    RelationID="e40206356bd63d3228d0c0facb669e62">
    <KindType>Client</KindType>
    <ProjectType>Library</ProjectType>
    <Name>Ntreev.Crema.Client.Tables</Name>
    <ProjectPath>client/Ntreev.Crema.Client.Tables/Ntreev.Crema.Client.Tables.csproj</ProjectPath>
  </ProjectInfo>
  <ProjectInfo
    CreatedDateTime="2017-10-31T06:53:14.4212452Z"
    Modifier="admin"
    ModifiedDateTime="2017-11-01T08:23:24.3494315Z"
    RelationID="428ca329fea347e1a0505168bd8f4c63">
    <KindType>Common</KindType>
    <ProjectType>Library</ProjectType>
    <Name>Ntreev.Crema.Presentation</Name>
    <ProjectPath>common/Ntreev.Crema.Presentation/Ntreev.Crema.Presentation.csproj</ProjectPath>
  </ProjectInfo>
  <ProjectInfo
    CreatedDateTime="2017-10-31T06:53:14.4212452Z"
    Modifier="admin"
    ModifiedDateTime="2017-11-01T08:23:24.3494315Z"
    RelationID="0be414facb2c5e43ee76a909bfff3ae6">
    <KindType>SubModule</KindType>
    <ProjectType>Library</ProjectType>
    <Name>Ntreev.ModernUI.Framework</Name>
    <ProjectPath>sub-modules/Ntreev.ModernUI.Framework/Ntreev.ModernUI.Framework/Ntreev.ModernUI.Framework.csproj</ProjectPath>
  </ProjectInfo>
  <ProjectInfo
    CreatedDateTime="2017-10-31T06:53:14.4212452Z"
    Modifier="s2quake"
    ModifiedDateTime="2018-03-27T05:12:57.0171832Z"
    RelationID="f9b4fbf403945fc41e028283ad40d269">
    <KindType>Client</KindType>
    <ProjectType>Library</ProjectType>
    <Name>Ntreev.Crema.Client.Converters</Name>
    <ProjectPath>client/Ntreev.Crema.Client.Converters/Ntreev.Crema.Client.Converters.csproj</ProjectPath>
  </ProjectInfo>
</Content>